source_id,title,organization,publication_date,access_date,url,local_raw_path,sha256,notes
eia_hormuz_tie_2025_06_16_html,"Amid regional conflict, the Strait of Hormuz remains critical oil chokepoint",U.S. Energy Information Administration,2025-06-16,2026-04-06,https://www.eia.gov/todayinenergy/detail.php?id=65504,data/raw/eia_hormuz_today_in_energy_2025-06-16.html,405fb2beaac7614ff7385b022a0e82ea77cfaccba2cd2282e537dd0c4f4998b9,"Primary narrative source for 2024 Hormuz flow, bypass, and destination statements."
eia_hormuz_fig1_2025_06_16_xlsx,EIA figure data: total oil flows through the Strait of Hormuz,U.S. Energy Information Administration,2025-06-16,2026-04-06,https://www.eia.gov/todayinenergy/images/2025.06.16/fig1.xlsx,data/raw/eia_hormuz_fig1_2025-06-16.xlsx,7bdddbc0f5b34ac63523f8fd42224129ba4c1b9f060eea2ee32fdc8c17d6043d,Contains annual total flow series for 2020-1Q25.
eia_hormuz_fig3_2025_06_16_xlsx,EIA figure data: Hormuz origin and destination flows,U.S. Energy Information Administration,2025-06-16,2026-04-06,https://www.eia.gov/todayinenergy/images/2025.06.16/fig3.xlsx,data/raw/eia_hormuz_fig3_2025-06-16.xlsx,a701a0e4b122a24df39ec7716b00e35a3bb0770e6a60560b240c7811ce3bd510,Contains 2020-1Q25 origin-country and destination-market series.
eia_top_oil_producers_consumers_faq_2024_04_11_html,What countries are the top producers and consumers of oil?,U.S. Energy Information Administration,2024-04-11,2026-04-06,https://www.eia.gov/tools/faqs/faq.php?id=709&t=6,data/raw/eia_top_producers_consumers_faq_2024-04-11.html,95fb21a8c72438182366f620dbe32924bfa1e28ee05f2f3e620519b073d65a4e,Used to justify geography-first node selection over company-level nodes.
eia_daily_prices_2026_04_06_html,Today in Energy Daily Prices,U.S. Energy Information Administration,2026-04-06,2026-04-06,https://www.eia.gov/todayinenergy/prices.php,data/raw/eia_daily_prices_2026-04-06.html,f19809b7451ae88020f958e6f0bc0cb593179985309abbe4a41f053f9a0e1ffd,Used for the latest observed Brent and WTI close available on the analysis date.
eia_steo_2026_03_pdf,"Short-Term Energy Outlook, March 2026",U.S. Energy Information Administration,2026-03-10,2026-04-06,https://www.eia.gov/outlooks/steo/pdf/steo_full.pdf,data/raw/eia_steo_full_2026-03.pdf,7b5f88f2059bb808efe366fad931ba656391675cb51b4086d60a3abac8449538,Used for the Brent floor and 2Q26 average anchor under continuing Hormuz disruption.
opec_2026_04_05_production_decision_html,"Saudi Arabia, Russia, Iraq, UAE, Kuwait, Kazakhstan, Algeria, and Oman adjust production and reaffirm commitment to market stability",Organization of the Petroleum Exporting Countries,2026-04-05,2026-04-06,https://www.opec.org/pr-detail/597-5-april-2026.html?mod=livecoverage_web,data/raw/opec_2026-04-05_production_decision.html,7f38b39c413a47780b1e6fdd96cd3e9b9a2a985fe7e202a8fe1d1ecbe6386801,Used for the May 2026 206 kb/d supply adjustment anchor and the statement on alternative export routes.
